[
  {
    "id": "i-mercoledi-della-cultura-2026",
    "startDate": "2026-06-24",
    "endDate": "2026-09-02",
    "displayDate": "24 Giu – 2 Set 2026",
    "time": "18:30 (mercoledì)",
    "title": "I Mercoledì della Cultura",
    "venue": "Villa Comunale, Roseto",
    "city": "Roseto",
    "description": "Rassegna culturale settimanale. Libri, incontri e presentazioni ogni mercoledì.",
    "tags": [
      "Cultura",
      "Libri"
    ],
    "sourceUrl": "https://www.rosetoproloco.it/index.php/eventi",
    "price": "gratis",
    "image": "",
    "updatedAt": "2026-07-26"
  },
  {
    "id": "personaggi-drammatici-che-si-manifestano-comicamente-2026",
    "startDate": "2026-07-01",
    "endDate": "2026-09-06",
    "displayDate": "1 Lug – 6 Set 2026",
    "time": "Tutto il giorno",
    "title": "Personaggi drammatici che si manifestano comicamente",
    "venue": "Roseto degli Abruzzi",
    "city": "Roseto",
    "description": "Personale di Illustrazioni di Pasquale Testa. Mostra di illustrazioni umoristiche.",
    "tags": [
      "Cultura",
      "Arte"
    ],
    "sourceUrl": "https://www.visitroseto.it/en/events/personaggi-drammatici-che-si-manifestano-comicamente/",
    "price": "gratis",
    "image": "images/personaggi-drammatici-che-si-manifestano-comicamente-2026.jpg",
    "updatedAt": "2026-09-01"
  },
  {
    "id": "villa-in-arte-2026",
    "startDate": "2026-07-10",
    "endDate": "2026-11-29",
    "displayDate": "10 Lug – 29 Nov 2026",
    "time": "15:00–21:00 (sabato e domenica)",
    "title": "Villa in Arte",
    "venue": "Villa Comunale, Via Nazionale 250, Roseto degli Abruzzi",
    "city": "Roseto",
    "description": "Mostra collettiva con oltre 60 opere, da Modigliani e De Chirico fino a Warhol e Kostabi, ospitata nella Villa Comunale di Roseto degli Abruzzi.",
    "tags": [
      "Cultura",
      "Arte"
    ],
    "sourceUrl": "https://www.visitroseto.it/events/14838/",
    "price": "gratis",
    "image": "images/img-1.jpg",
    "updatedAt": "2026-09-18"
  },
  {
    "id": "matteo-mancuso-in-concerto-2026",
    "startDate": "2026-07-21",
    "endDate": "2026-07-21",
    "displayDate": "21 Lug 2026",
    "time": "21:30",
    "title": "Matteo Mancuso in concerto",
    "venue": "Portorose, Roseto",
    "city": "Roseto",
    "description": "Abbazie Summer Festival 2026. Chitarrista di talento internazionale.",
    "tags": [
      "Musica",
      "Abbazie Summer Festival"
    ],
    "sourceUrl": "https://concertidelleabbazie.it/programma/",
    "price": "a pagamento",
    "image": "images/img-20.jpg",
    "updatedAt": "2026-07-26"
  },
  {
    "id": "17-sagra-de-lu-stennmass-2026",
    "startDate": "2026-07-22",
    "endDate": "2026-07-26",
    "displayDate": "22–26 Lug 2026",
    "time": "Dalle 19:00",
    "title": "17ª Sagra 'De lu Stennmass'",
    "venue": "Cologna Paese, Roseto",
    "city": "Roseto",
    "description": "Sagra enogastronomica tradizionale. Specialità locali e atmosfera di festa.",
    "tags": [
      "Enogastronomia",
      "Sagra"
    ],
    "sourceUrl": "https://www.visitroseto.it/eventi/",
    "price": "gratis",
    "image": "images/img-23.jpg",
    "updatedAt": "2026-07-26"
  },
  {
    "id": "billy-cobham-time-machine-2026",
    "startDate": "2026-07-22",
    "endDate": "2026-07-22",
    "displayDate": "22 Lug 2026",
    "time": "21:30",
    "title": "Billy Cobham – Time Machine",
    "venue": "Portorose, Roseto",
    "city": "Roseto",
    "description": "Leggendario percussionista jazz di fama internazionale. Abbazie Summer Festival.",
    "tags": [
      "Musica",
      "Jazz",
      "Abbazie Summer Festival"
    ],
    "sourceUrl": "https://concertidelleabbazie.it/programma/",
    "price": "a pagamento",
    "image": "images/img-21.jpg",
    "updatedAt": "2026-07-26"
  },
  {
    "id": "marche-manouche-dario-napoli-trio-2026",
    "startDate": "2026-07-22",
    "endDate": "2026-07-22",
    "displayDate": "22 Lug 2026",
    "time": "21:00",
    "title": "Marche Manouche – Dario Napoli Trio",
    "venue": "San Benedetto del Tronto",
    "city": "San Benedetto",
    "description": "Jazz Manouche moderno.",
    "tags": [
      "Musica",
      "Jazz"
    ],
    "sourceUrl": "https://www.nonsoloeventimarche.it/",
    "price": "gratis",
    "image": "images/img-22.jpg",
    "updatedAt": "2026-07-26"
  },
  {
    "id": "4-moonjune-festival-eclectic-music-2026",
    "startDate": "2026-07-23",
    "endDate": "2026-07-23",
    "displayDate": "23 Lug 2026",
    "time": "20:00",
    "title": "4° MoonJune Festival – Eclectic Music",
    "venue": "Teramo",
    "city": "Teramo",
    "description": "Festival di musica eclettica. MoonJune Records 25 anni. Soft Machine, Gong, Osanna, Steve Hillage e molti altri.",
    "tags": [
      "Musica",
      "Festival"
    ],
    "sourceUrl": "https://www.moonjunefest.com/",
    "price": "a pagamento",
    "image": "images/img-24.jpg",
    "updatedAt": "2026-07-26"
  },
  {
    "id": "art-in-act-2026",
    "startDate": "2026-07-24",
    "endDate": "2026-10-31",
    "displayDate": "24 Lug – 31 Ott 2026",
    "time": "18:30–21:30 (mercoledì–venerdì; settembre e ottobre su richiesta)",
    "title": "Art in Act 2026",
    "venue": "Villa Paris (via Marcacci 1), Roseto",
    "city": "Roseto",
    "description": "Inaugurazione mostra d'arte collettiva.",
    "tags": [
      "Cultura",
      "Arte"
    ],
    "sourceUrl": "https://www.rosetoproloco.it/index.php/eventi/cerca-eventi/376-art-in-act-2026/2026-07-24-00-00",
    "price": "gratis",
    "image": "images/img-art-in-act-2026.jpg",
    "updatedAt": "2026-08-28"
  },
  {
    "id": "c-era-una-volta-morricone-e-leone-2026",
    "startDate": "2026-07-24",
    "endDate": "2026-07-24",
    "displayDate": "24 Lug 2026",
    "time": "21:30",
    "title": "C'era una volta... Morricone e Leone",
    "venue": "Piazza Ponno, Roseto",
    "city": "Roseto",
    "description": "Omaggio al sodalizio artistico tra Ennio Morricone e Sergio Leone. Musica e immagini.",
    "tags": [
      "Musica",
      "Cultura",
      "Spettacolo"
    ],
    "sourceUrl": "https://www.visitroseto.it/eventi/",
    "price": "gratis",
    "image": "images/img-28.jpg",
    "updatedAt": "2026-07-26"
  },
  {
    "id": "mons-pagus-a-d-1566-rievocazione-2026",
    "startDate": "2026-07-24",
    "endDate": "2026-07-25",
    "displayDate": "24–25 Lug 2026",
    "time": "19:00",
    "title": "Mons Pagus A.D. 1566 – Rievocazione",
    "venue": "Borgo di Montepagano, Roseto",
    "city": "Roseto",
    "description": "9ª edizione della rievocazione storica rinascimentale. Taverne, musica e spettacoli nel borgo.",
    "tags": [
      "Cultura",
      "Rievocazione",
      "Enogastronomia"
    ],
    "sourceUrl": "https://www.visitroseto.it/eventi/",
    "price": "gratis",
    "image": "images/img-25.jpg",
    "updatedAt": "2026-07-26"
  },
  {
    "id": "che-s-e-benedette-sti-badante-commedia-2026",
    "startDate": "2026-07-25",
    "endDate": "2026-07-25",
    "displayDate": "25 Lug 2026",
    "time": "21:00",
    "title": "Che s'è benedette sti badante – Commedia",
    "venue": "Voltarrosto, Roseto",
    "city": "Roseto",
    "description": "Commedia teatrale dialettale. Serata di teatro popolare.",
    "tags": [
      "Cultura",
      "Teatro"
    ],
    "sourceUrl": "https://www.visitroseto.it/eventi/",
    "price": "gratis",
    "image": "images/img-29.jpg",
    "updatedAt": "2026-07-26"
  },
  {
    "id": "giornata-mondiale-della-prevenzione-dell-annegamento-2026",
    "startDate": "2026-07-25",
    "endDate": "2026-07-25",
    "displayDate": "25 Lug 2026",
    "time": "11:00",
    "title": "Giornata Mondiale della Prevenzione dell'Annegamento",
    "venue": "Lido Celommi, Roseto",
    "city": "Roseto",
    "description": "Mattinata dedicata alla sicurezza in mare e alla prevenzione degli incidenti balneari. Bandiera Blu.",
    "tags": [
      "Sport",
      "Cultura"
    ],
    "sourceUrl": "https://www.visitroseto.it/eventi/",
    "price": "gratis",
    "image": "images/img-40.jpg",
    "updatedAt": "2026-07-26"
  },
  {
    "id": "roseto-d-amare-gran-gala-lirico-2026",
    "startDate": "2026-07-26",
    "endDate": "2026-07-26",
    "displayDate": "26 Lug 2026",
    "time": "21:15",
    "title": "Roseto d'aMare – Gran Galà Lirico",
    "venue": "Piazza del Municipio, Montepagano",
    "city": "Roseto",
    "description": "Orchestra 'Duchi d'Acquaviva'. Sara Fulvi (soprano), Giacomo Leone (tenore), Vittorio Del Monte (basso-baritono).",
    "tags": [
      "Musica",
      "Classica"
    ],
    "sourceUrl": "https://www.visitroseto.it/eventi/",
    "price": "gratis",
    "image": "images/img-30.jpg",
    "updatedAt": "2026-07-26"
  },
  {
    "id": "roseto-west-fest-2026",
    "startDate": "2026-07-29",
    "endDate": "2026-08-02",
    "displayDate": "29 Lug – 2 Ago 2026",
    "time": "19:30",
    "title": "Roseto West Fest 2026",
    "venue": "Chiesa di Santa Teresa di Calcutta, Roseto",
    "city": "Roseto",
    "description": "Cinque serate all'insegna di enogastronomia, musica e intrattenimento per tutta la famiglia.",
    "tags": [
      "Enogastronomia",
      "Musica"
    ],
    "sourceUrl": "https://www.visitroseto.it/eventi/",
    "price": "gratis",
    "image": "images/img-41.jpg",
    "updatedAt": "2026-07-26"
  },
  {
    "id": "baccano-mostra-dei-vini-54-ed-2026",
    "startDate": "2026-07-31",
    "endDate": "2026-08-02",
    "displayDate": "31 Lug – 2 Ago 2026",
    "time": "19:00–23:00",
    "title": "Baccano – Mostra dei Vini 54ª ed.",
    "venue": "Roseto degli Abruzzi",
    "city": "Roseto",
    "description": "Mostra enogastronomica dei vini locali. Degustazioni e stand gastronomici.",
    "tags": [
      "Enogastronomia",
      "Cultura"
    ],
    "sourceUrl": "https://www.visitroseto.it/eventi/",
    "price": "gratis",
    "image": "images/img-37.jpg",
    "updatedAt": "2026-07-26"
  },
  {
    "id": "i-cani-transumare-nello-spazio-2026",
    "startDate": "2026-08-01",
    "endDate": "2026-08-01",